{
  "BluDoc.Version": "1.4.0",
  "Created.DateTime": "2024-06-12T15:03:13.9086976+00:00",
  "CreatorSoftware.Name": "quotation",
  "CreatorSoftware.Version": "v0.1.0",
  "Document.Languages": [
    "de"
  ],
  "Document.Type": "Quotation",
  "DocumentEssentials": [
    {
      "Confidence": 0.6393,
      "ConfidenceThreshold": -1,
      "Label": "Quotation.Id",
      "Location": {
        "Height": 35,
        "Left": 2163,
        "Page": 1,
        "Top": 1372,
        "Width": 147
      },
      "Text": "898989",
      "Value": "898989"
    },
    {
      "Confidence": 0.9394,
      "ConfidenceThreshold": -1,
      "Label": "Quotation.Date",
      "Location": {
        "Height": 35,
        "Left": 2088,
        "Page": 1,
        "Top": 1427,
        "Width": 223
      },
      "Text": "02.05.2024",
      "Value": "2024-05-02"
    },
    {
      "Confidence": 0,
      "ConfidenceThreshold": -1,
      "Label": "ReceiverOrder.Id",
      "Text": "",
      "Value": ""
    },
    {
      "Confidence": 0.9802,
      "ConfidenceThreshold": -1,
      "Label": "GrandTotal.Amount",
      "Location": {
        "Height": 31,
        "Left": 2131,
        "Page": 1,
        "Top": 2762,
        "Width": 96
      },
      "Text": "241,08",
      "Value": "241.08"
    },
    {
      "Confidence": 0,
      "ConfidenceThreshold": -1,
      "Label": "VatId",
      "Text": "",
      "Value": ""
    },
    {
      "Confidence": 0.9997,
      "ConfidenceThreshold": -1,
      "Label": "Sender.VatId",
      "Location": {
        "Height": 35,
        "Left": 2001,
        "Page": 1,
        "Top": 679,
        "Width": 283
      },
      "Text": "ATU70948479",
      "Value": "ATU70948479"
    },
    {
      "Confidence": 0.9996,
      "ConfidenceThreshold": -1,
      "Label": "Receiver.VatId",
      "Location": {
        "Height": 35,
        "Left": 524,
        "Page": 1,
        "Top": 944,
        "Width": 284
      },
      "Text": "ATU12345678",
      "Value": "ATU12345678"
    },
    {
      "Confidence": 0,
      "ConfidenceThreshold": -1,
      "Label": "Automotive.Plate.Id",
      "Text": "",
      "Value": ""
    },
    {
      "Confidence": 0,
      "ConfidenceThreshold": -1,
      "Label": "Automotive.Vin.Id",
      "Text": "",
      "Value": ""
    },
    {
      "Confidence": 0,
      "ConfidenceThreshold": -1,
      "Label": "Automotive.Mileage",
      "Text": "",
      "Value": ""
    },
    {
      "Confidence": 0,
      "ConfidenceThreshold": -1,
      "Label": "Automotive.FirstRegistration.Date",
      "Text": "",
      "Value": ""
    },
    {
      "Confidence": 0,
      "ConfidenceThreshold": -1,
      "Label": "Sender.TaxId",
      "Text": "",
      "Value": ""
    },
    {
      "Confidence": 0,
      "ConfidenceThreshold": -1,
      "Label": "Receiver.TaxId",
      "Text": "",
      "Value": ""
    },
    {
      "Confidence": 0.8267834782600403,
      "ConfidenceThreshold": -1,
      "Items": [
        {
          "Confidence": 0.9691,
          "ConfidenceThreshold": -1,
          "Label": "Contact.Name",
          "Location": {
            "Height": 32,
            "Left": 265,
            "Page": 1,
            "Top": 3117,
            "Width": 420
          },
          "Text": "Blumatix Intelligence GmbH",
          "Value": "Blumatix Intelligence GmbH"
        },
        {
          "Confidence": 0,
          "ConfidenceThreshold": -1,
          "Label": "Attention.Name",
          "Text": "",
          "Value": ""
        },
        {
          "Confidence": 0.9652,
          "ConfidenceThreshold": -1,
          "Label": "Contact.Street",
          "Location": {
            "Height": 26,
            "Left": 264,
            "Page": 1,
            "Top": 3157,
            "Width": 268
          },
          "Text": "Schwarzstraße 48",
          "Value": "Schwarzstraße 48"
        },
        {
          "Confidence": 0.9368,
          "ConfidenceThreshold": -1,
          "Label": "Contact.ZipCode",
          "Location": {
            "Height": 26,
            "Left": 264,
            "Page": 1,
            "Top": 3198,
            "Width": 68
          },
          "Text": "5020",
          "Value": "5020"
        },
        {
          "Confidence": 0.9402,
          "ConfidenceThreshold": -1,
          "Label": "Contact.City",
          "Location": {
            "Height": 32,
            "Left": 351,
            "Page": 1,
            "Top": 3198,
            "Width": 120
          },
          "Text": "Salzburg",
          "Value": "Salzburg"
        },
        {
          "Confidence": 0,
          "ConfidenceThreshold": -1,
          "Label": "Contact.Region",
          "Text": "",
          "Value": ""
        },
        {
          "Confidence": 0,
          "ConfidenceThreshold": -1,
          "Label": "Contact.Country",
          "Text": "",
          "Value": ""
        },
        {
          "Confidence": 0,
          "ConfidenceThreshold": -1,
          "Label": "Contact.Website",
          "Text": "",
          "Value": ""
        },
        {
          "Confidence": 0,
          "ConfidenceThreshold": -1,
          "Label": "Contact.Email",
          "Text": "",
          "Value": ""
        },
        {
          "Confidence": 0,
          "ConfidenceThreshold": -1,
          "Label": "Contact.Phone",
          "Text": "",
          "Value": ""
        }
      ],
      "Label": "Sender.Contact.Item",
      "Location": {
        "Height": 127,
        "Left": 258,
        "Page": 1,
        "Top": 3123,
        "Width": 449
      },
      "Text": "",
      "Value": ""
    },
    {
      "Confidence": 0.6635317802429199,
      "ConfidenceThreshold": -1,
      "Items": [
        {
          "Confidence": 0.9664,
          "ConfidenceThreshold": -1,
          "Label": "Contact.Name",
          "Location": {
            "Height": 36,
            "Left": 243,
            "Page": 1,
            "Top": 638,
            "Width": 556
          },
          "Text": "Max Mustermann GmbH",
          "Value": "Max Mustermann GmbH"
        },
        {
          "Confidence": 0,
          "ConfidenceThreshold": -1,
          "Label": "Attention.Name",
          "Text": "",
          "Value": ""
        },
        {
          "Confidence": 0.9648,
          "ConfidenceThreshold": -1,
          "Label": "Contact.Street",
          "Location": {
            "Height": 35,
            "Left": 243,
            "Page": 1,
            "Top": 699,
            "Width": 248
          },
          "Text": "Musterstr. 8",
          "Value": "Musterstr. 8"
        },
        {
          "Confidence": 0.9893,
          "ConfidenceThreshold": -1,
          "Label": "Contact.ZipCode",
          "Location": {
            "Height": 35,
            "Left": 241,
            "Page": 1,
            "Top": 762,
            "Width": 122
          },
          "Text": "80538",
          "Value": "80538"
        },
        {
          "Confidence": 0.9832,
          "ConfidenceThreshold": -1,
          "Label": "Contact.City",
          "Location": {
            "Height": 36,
            "Left": 388,
            "Page": 1,
            "Top": 761,
            "Width": 175
          },
          "Text": "München",
          "Value": "München"
        },
        {
          "Confidence": 0,
          "ConfidenceThreshold": -1,
          "Label": "Contact.Region",
          "Text": "",
          "Value": ""
        },
        {
          "Confidence": 0.9897,
          "ConfidenceThreshold": -1,
          "Label": "Contact.Country",
          "Location": {
            "Height": 36,
            "Left": 243,
            "Page": 1,
            "Top": 821,
            "Width": 239
          },
          "Text": "Deutschland",
          "Value": "DE"
        },
        {
          "Confidence": 0,
          "ConfidenceThreshold": -1,
          "Label": "Contact.Website",
          "Text": "",
          "Value": ""
        },
        {
          "Confidence": 0,
          "ConfidenceThreshold": -1,
          "Label": "Contact.Email",
          "Text": "",
          "Value": ""
        },
        {
          "Confidence": 0,
          "ConfidenceThreshold": -1,
          "Label": "Contact.Phone",
          "Text": "",
          "Value": ""
        }
      ],
      "Label": "Receiver.Contact.Item",
      "Location": {
        "Height": 236,
        "Left": 239,
        "Page": 1,
        "Top": 638,
        "Width": 587
      },
      "Text": "",
      "Value": ""
    },
    {
      "Confidence": 0,
      "ConfidenceThreshold": -1,
      "Items": [
        {
          "Confidence": 0,
          "ConfidenceThreshold": -1,
          "Label": "Contact.Name",
          "Text": "",
          "Value": ""
        },
        {
          "Confidence": 0,
          "ConfidenceThreshold": -1,
          "Label": "Attention.Name",
          "Text": "",
          "Value": ""
        },
        {
          "Confidence": 0,
          "ConfidenceThreshold": -1,
          "Label": "Contact.Street",
          "Text": "",
          "Value": ""
        },
        {
          "Confidence": 0,
          "ConfidenceThreshold": -1,
          "Label": "Contact.ZipCode",
          "Text": "",
          "Value": ""
        },
        {
          "Confidence": 0,
          "ConfidenceThreshold": -1,
          "Label": "Contact.City",
          "Text": "",
          "Value": ""
        },
        {
          "Confidence": 0,
          "ConfidenceThreshold": -1,
          "Label": "Contact.Region",
          "Text": "",
          "Value": ""
        },
        {
          "Confidence": 0,
          "ConfidenceThreshold": -1,
          "Label": "Contact.Country",
          "Text": "",
          "Value": ""
        },
        {
          "Confidence": 0,
          "ConfidenceThreshold": -1,
          "Label": "Contact.Website",
          "Text": "",
          "Value": ""
        },
        {
          "Confidence": 0,
          "ConfidenceThreshold": -1,